SteamId,ProfileURL,ReviewText,Review,ReviewLength(Chars),PlayHours,DatePosted
7.65612E+16,https://steamcommunity.com/profiles/76561199592237649/,Ruined By Cheaters,Not Recommended,16,82.1 hrs on record,Posted: February 20
7.65612E+16,https://steamcommunity.com/profiles/76561199081370213/,"should have made cs2 another game
csgo graphics had soul and did not make my pc stutter when i see an endmy",Not Recommended,87,437.0 hrs on record,"Posted: December 2, 2024"
7.65612E+16,https://steamcommunity.com/profiles/76561198056257778/,"RIP CSGO u will be missed. This is a terrible game to replace GO. If they released this seperately from GO this would have 0 players online. Fix ur game valve. I click on man, man no die.",Not Recommended,150,"1,473.3 hrs on record",Posted: April 22
SingularityZer0,https://steamcommunity.com/id/SingularityZer0/,"With this release Valve has provided a definite proof of their incompetence as a game developer. Keep milking those key and prime upgrade sales, as your game is run into the ground by cheaters,",Not Recommended,160,670.7 hrs on record,"Posted: July 7, 2024"
seulcontretous,https://steamcommunity.com/id/seulcontretous/,"Casino Strike 2 updated their slot machines with new shiny pixels!
Addicted people (me and my friends) are very happy!",Not Recommended,100,614.5 hrs on record,"Posted: June 27, 2024"
7.65612E+16,https://steamcommunity.com/profiles/76561198909237319/,"This game kicks people for being top frag ""too much damage"".
has loads of bugs and issues most the player base struggles with and never fixes them.
you can get a 30 min ban for teamates choosing to stand in your grenades.
bullets dont register.
they never update the game with any new good content like maps.",Not Recommended,256,"1,937.7 hrs on record","Posted: July 12, 2024"
7.65612E+16,https://steamcommunity.com/profiles/76561198095956796/,if you want to have fun then dont ever play this ♥♥♥♥♥♥♥ game. It's full of cheaters for a 10+ years game. it's just sooooooooooo bad broooooooooooooooooo. what is the use of the report button really. I want to know. Its useless.,Not Recommended,188,"1,739.8 hrs on record","Posted: November 5, 2024"
7.65612E+16,https://steamcommunity.com/profiles/76561199822814770/,Game needs a serious ANTI CHEAT system.,Not Recommended,33,136.2 hrs on record,Posted: February 10
7.65612E+16,https://steamcommunity.com/profiles/76561198025851144/,"♥♥♥♥ reg, ♥♥♥♥ movement, ♥♥♥♥ feel, ♥♥♥♥ this ♥♥♥♥ that, give us csgo back",Not Recommended,61,"2,686.1 hrs on record","Posted: September 10, 2024"
Koffeei,https://steamcommunity.com/id/Koffeei/,you know.,Not Recommended,8,"2,467.1 hrs on record",Posted: March 8
7.65612E+16,https://steamcommunity.com/profiles/76561198851239496/,CS:GO better,Not Recommended,11,475.8 hrs on record,"Posted: May 23, 2024"
7.65612E+16,https://steamcommunity.com/profiles/76561198968723679/,"Product received for free

If Valve refuses to #fixtf2 then why would the fix cs2?

i mean it's happening already",Not Recommended,96,6.4 hrs on record,"Posted: June 4, 2024"
firek5,https://steamcommunity.com/id/firek5/,Duk this game,Not Recommended,11,"1,064.4 hrs on record","Posted: October 11, 2024"
domezomiyamoto,https://steamcommunity.com/id/domezomiyamoto/,Not csgo,Not Recommended,7,"1,451.0 hrs on record","Posted: May 18, 2024"
twks,https://steamcommunity.com/id/twks/,"infested with cheaters, 80% of players from premier/competitive are cheaters or spinbotters",Not Recommended,80,"5,170.4 hrs on record","Posted: August 17, 2024"
brocli_supreme,https://steamcommunity.com/id/brocli_supreme/,"❌first-person shooter
✅gambling software",Not Recommended,38,"2,307.7 hrs on record","Posted: July 14, 2024"
fherdiew,https://steamcommunity.com/id/fherdiew/,"As i wrote this review the current state of the game is really awful.

10 Years since the first time i've been playing CSGO and this is the first time i've meet so many cheaters! in both premier and competitive. (Remind you im not type of guy who just start yelling and saying someone is cheating because they're good.) Im not saying CSGO was a perfect game either but in CS2 ive just meet a lot of cheater in row more than in CSGO.

The ranked points sistem is also awful and unbalanced. when CS2 was introduced people keep saying it will gets balance over time, but nope it have been almost a year and the sistem still bad. How is fair for people who has rank lets just say Guardian Elite only get 5k points? if you're Nova 1 before but got lucky you can get 10k immediately. So because of this they just make a new MORE arbitrary matchmaking system. if you're new on CS2 sometimes your enemies/teammates either its have same skill as you and have the actual skills 4k players points OR just some dude who have 3000 hours who just to happen got 5k points.

This is just based on my personal experience, maybe you like the new ranked system, or maybe you just never found cheater in your match and having a good times, Then is good for you!

The game is good when is works, but for me is just pain haha
This is just a warning for new players who want to try CS2 and old timers like me who just start playing CS again this weeks. Just play it once a week, especially on wednesday where they reset a drop cases and you can sell it for some bucks if you're lucky.",Not Recommended,1266,"1,235.0 hrs on record","Posted: May 23, 2024"
7.65612E+16,https://steamcommunity.com/profiles/76561198061003522/,#AllowClassicOffensive,Not Recommended,22,38.2 hrs on record,Posted: May 9
7.65612E+16,https://steamcommunity.com/profiles/76561199438863513/,csgo better L game,Not Recommended,15,199.0 hrs on record,"Posted: July 18, 2024"
qsxvacgg1,https://steamcommunity.com/id/qsxvacgg1/,bring back de_lake,Not Recommended,16,223.0 hrs on record,"Posted: June 15, 2024"
00face,https://steamcommunity.com/id/00face/,It just isn't fun for me. The community is angry and bitter even when they are winning. I could care less about skins.,Not Recommended,96,26.4 hrs on record,"Posted: August 21, 2024"
Man7B,https://steamcommunity.com/id/Man7B/,game kiri,Not Recommended,8,"3,832.5 hrs on record",Posted: February 20
7.65612E+16,https://steamcommunity.com/profiles/76561198018555468/,this game sucks rn,Not Recommended,15,"1,544.1 hrs on record","Posted: December 25, 2024"
7.65612E+16,https://steamcommunity.com/profiles/76561198047779718/,needs better anti cheat,Not Recommended,20,"3,859.4 hrs on record","Posted: October 15, 2024"
HarrisonWe,https://steamcommunity.com/id/HarrisonWe/,"Counter-Strike 2: Cheaters strikes back
Counter-Strike 2: Rise of Cheaters
Counter-Strike 2 and the order of cheaters
Counter-Strike 2 and... well, you know.",Not Recommended,138,562.5 hrs on record,"Posted: June 24, 2024"
7.65612E+16,https://steamcommunity.com/profiles/76561198957182919/,"If you're thinking of installing this, I'll tell you something. I spent more than a thousand hours on this joke and I deeply regret it. I could have used this time for something productive if someone told me to let it go. Go do something that adds to your life, don't install this crap.",Not Recommended,233,"1,185.1 hrs on record",Posted: March 8
pontikaras,https://steamcommunity.com/id/pontikaras/,"I really like the game but cheaters are ruining the experience i don't mind the other problems so much but cheaters are destroying everything , in a game that is full tactical and needs so much of practice and hours from your life i cant stand that almost in every premier (ranked) match is at-least one cheater its just sad !!!!",Not Recommended,269,"1,182.5 hrs on record",Posted: March 31
7.65612E+16,https://steamcommunity.com/profiles/76561198137077036/,CSGO was better,Not Recommended,13,"3,650.2 hrs on record",Posted: April 5
LoveHoney,https://steamcommunity.com/id/LoveHoney/,"Trash ass game, full of bots, hackers and bad optimization. I play because i am addicted... not because the game is good.",Not Recommended,100,"1,295.0 hrs on record","Posted: October 24, 2024"
7.65612E+16,https://steamcommunity.com/profiles/76561198312697172/,csgo better,Not Recommended,10,"3,982.0 hrs on record","Posted: December 24, 2024"
asfsgerhrjgnmbnkyu,https://steamcommunity.com/id/asfsgerhrjgnmbnkyu/,guys better buy beer 4 yourself also a flower 4ur mommies,Not Recommended,47,105.4 hrs on record,"Posted: December 10, 2024"
7.65612E+16,https://steamcommunity.com/profiles/76561199030056113/,"VALVE should take its VAC system and shove it up their asses,",Not Recommended,50,842.3 hrs on record,"Posted: September 2, 2024"
7.65612E+16,https://steamcommunity.com/profiles/76561198325363466/,"Basically towards the end of every game its 80% hack vs hack and you just stand there and wait for it to end, ♥♥♥♥ valve honestly",Not Recommended,104,234.7 hrs on record,Posted: April 3
titus_grondahl,https://steamcommunity.com/id/titus_grondahl/,"Other players are better than me so I die alot, therefore its not so fun",Not Recommended,58,659.8 hrs on record,"Posted: September 13, 2024"
kamikadzeisacunt,https://steamcommunity.com/id/kamikadzeisacunt/,ПОЛНАЯ XYЙHЯ:steamthumbsup::steamthumbsup::steamthumbsup:,Not Recommended,56,193.7 hrs on record,"Posted: June 26, 2024"
7.65612E+16,https://steamcommunity.com/profiles/76561198801766024/,"Massive Cheater and more massive Server Problems! How can a million dollar franchise provide such bad network settings that you have to face so many jitter problems. Valve please start fixing the game than bringing new skins...
it sucks!",Not Recommended,200,499.8 hrs on record,"Posted: December 10, 2024"
xbr00dalx,https://steamcommunity.com/id/xbr00dalx/,I have never had a worse experience than playing this game. The solo queuing is horrendous and the ranking system is broken beyond repair. I went from 17000+ elo and dropped to 5.5k and have no chance of climbing back as my teammates have an IQ lower than the cockroaches that roam their rooms. Please turn the original counter strike global offensive servers on. I have valve and their anti cheat system and their ability to make fun mulitplayer games. I hope that every person working on this game finds a new job and that the game shuts down.,Not Recommended,447,"2,746.5 hrs on record","Posted: November 12, 2024"
ghalvinn,https://steamcommunity.com/id/ghalvinn/,"r.i.p movement how to kill your game tutorial
love valve thank you for making your game unbearable
<3",Not Recommended,86,743.0 hrs on record,"Posted: August 20, 2024"
DurAngEdMonKey,https://steamcommunity.com/id/DurAngEdMonKey/,"when they switched from GO to 2 this game became the worst fps of the decade, id rather shove a rusty nail down my urethra than try to take this ♥♥♥♥♥♥♥ seriously",Not Recommended,131,"2,308.0 hrs on record","Posted: May 24, 2024"
7.65612E+16,https://steamcommunity.com/profiles/76561198079192744/,Game is full of cheaters and not playable anymore. This is very sad. The developers don't seem to care at all.,Not Recommended,90,"1,273.3 hrs on record","Posted: December 28, 2024"
DoomerMillennial,https://steamcommunity.com/id/DoomerMillennial/,#AllowClassicOffensive,Not Recommended,22,25.2 hrs on record,Posted: May 7
420BLAZEITUNSTOPABLE,https://steamcommunity.com/id/420BLAZEITUNSTOPABLE/,"Full of cheaters, getting headshot through wall. Multiple DEMOs confirmed by many people and VALVE just dont give a ♥♥♥♥. just milking skins",Not Recommended,118,"1,064.3 hrs on record",Posted: April 8
7.65612E+16,https://steamcommunity.com/profiles/76561199493208199/,"This game doesn't have anti-cheat, as if chatting is free in this game, there are people who have prime accounts, but they still chat.",Not Recommended,111,407.0 hrs on record,"Posted: June 19, 2024"
7.65612E+16,https://steamcommunity.com/profiles/76561198255842835/,"Valve is really taking the piss with the latest Armory update. No significant game play updates, another iteration of FPS hits, persistent networking issues, non-existent anti-cheat, and yet they have the gall to push an update with all the monetized aspects of an operation, but none of the content.

Deeply disappointed, please do better.",Not Recommended,288,"1,938.5 hrs on record","Posted: October 3, 2024"
7.65612E+16,https://steamcommunity.com/profiles/76561198067345870/,"The sheer arrogance of Valve to release one of the greediest, lowest-value micro-transaction packs in recent memory is astonishing. Even for a game known to be more or less just a casino simulator, it's just hard to swallow with the missing features and such. It's as if to suggest Valve needs a cash injection to keep the lights on, which is obscene to even suggest.",Not Recommended,303,33.6 hrs on record,"Posted: October 3, 2024"
siveillance,https://steamcommunity.com/id/siveillance/,"There are too many cheaters, and Valve can't find any solution. Why aren't hardware bans applied to players detected using cheats? A cheater has to get caught in Overwatch, receive a cheating conviction, and get their account banned. Then, they'll just buy another prime account for a few bucks and continue ruining our games. Since Valve isn't addressing this issue, every player over 30 that I've talked to believes Valve itself is the one releasing these cheats. Until Valve finds a definitive solution to cheating, all non-cheating CS2 players should boycott Valve.",Not Recommended,478,"1,758.7 hrs on record",Posted: March 9
7.65612E+16,https://steamcommunity.com/profiles/76561199044516432/,"If you thought the gameplay and matchmaking issues were bad, just wait until you encounter CS2's thriving population of cheaters. This game isn’t just a playground for hackers—it’s their personal kingdom, where they run unchecked and unchallenged. Aimbots, wallhacks, spinbots—you name it, and you’ll see it in almost every match. What’s worse is that Valve doesn’t seem to care.

VAC: A Dinosaur of Anti-Cheat Systems
Valve Anti-Cheat (VAC) is the same antiquated system they’ve been parading around for years, and it’s utterly useless in Counter-Strike 2. Cheaters laugh at it as they blatantly ruin match after match. VAC bans, if they ever come, happen weeks after the damage is done—long enough for the cheater to create a new account and start the cycle all over again. It’s not just ineffective; it’s insulting.

A Cheater's Paradise
Cheaters have become so rampant in CS2 that it feels like they outnumber legitimate players in ranked matches. The sheer audacity of some of these hackers—openly mocking their opponents while flaunting their cheats—shows just how toothless Valve’s response is. Even in supposedly ""high-rank"" games, the presence of cheaters destroys any sense of competition or fairness.

False Promises and Empty Words
Valve promised improvements to anti-cheat for CS2, but what we got is a hollow PR statement with zero tangible results. If anything, the situation has worsened. Features like kernel-level anti-cheat, used by competitors like Riot’s Vanguard, aren’t even on the table. Instead, players are left to report cheaters manually, which feels like screaming into the void.

Impact on the Community
The cheater infestation has turned the once-loyal Counter-Strike community into a bitter, disillusioned group. Legitimate players are abandoning the game in droves, leaving only the cheaters and those masochistic enough to endure this broken experience. CS2’s potential for competitive play has been utterly destroyed by Valve’s negligence.

Counter-Strike 2 isn’t just failing to deal with cheaters—it’s actively enabling them. At this point, calling the game “unplayable” is generous. Valve’s refusal to take anti-cheat measures seriously is the ultimate betrayal to its player base. This isn’t just a problem—it’s a catastrophe.",Not Recommended,1930,338.4 hrs on record,"Posted: December 9, 2024"
VincentPeppler,https://steamcommunity.com/id/VincentPeppler/,money hungry valve classic,Not Recommended,23,494.6 hrs on record,"Posted: October 5, 2024"
skudgemuffin,https://steamcommunity.com/id/skudgemuffin/,worse than cs:go,Not Recommended,14,59.7 hrs on record,Posted: March 26
7.65612E+16,https://steamcommunity.com/profiles/76561198840638563/,Literaly every f*cking game has a cheater ethier in your team or enemy.,Not Recommended,59,618.4 hrs on record,"Posted: September 27, 2024"
bobef9,https://steamcommunity.com/id/bobef9/,"Game's filled with hackers, big L. Bring back csgo",Not Recommended,42,"3,154.9 hrs on record","Posted: May 9, 2024"
lakosantal,https://steamcommunity.com/id/lakosantal/,#AllowClassicOffensive,Not Recommended,22,84.1 hrs on record,Posted: May 9
7.65612E+16,https://steamcommunity.com/profiles/76561199086475788/,don't play,Not Recommended,9,"1,304.9 hrs on record","Posted: October 5, 2024"
Crazyman02525,https://steamcommunity.com/id/Crazyman02525/,"CS2 has some major performance issues that have not been acknowledged by Valve, it is to a point where I cannot play a match of CS2 without having performance issues or running into a cheater. I love playing counter strike and i want to play it again but these issues need to be resolved instead of focusing on releasing more things to pay for. Instead of the happiness I would feel playing CSGO it is instead frustration and disappointment from CS2 :(",Not Recommended,371,"1,576.1 hrs on record","Posted: October 3, 2024"
momo1181,https://steamcommunity.com/id/momo1181/,"VALVE PLS READ! I can't finish a single game, because I get disconnected. The console always says the same thing: NetChan Setting Timeout

I've tired EVERYTHING to fix this. I've manually opened ports on my router, enabled IP pass through, uninstalled my antivirus, turned off my firewall, disabled remote play, changed every setting possible in the game, reinstalled the game, ran as administrator, and more. I'm plugged directly into my router, I have gigabyte internet, and my ping is consistently low. My connection is rock solid. It's AT&T fiber in a major US metro area, so I don't get it.

I contacted Valve multiple times and they're literally 0 help. They just tell me ask in the Community Discussions and figure it out. Here you'll find multiple threads, some dating back years (when it was CSGO), but nobody ever has an actual fix.

CS2 is the only game I've ever had this issue. It started a couple months ago. Before that it was fine. The issue now isn't even sporadic - it's every single game I join. It might happen 3, 7, or 10 minutes in, but at some point I get disconnected. My hardware hasn't changed, nor has my ISP.

Someone please help me :[",Not Recommended,962,203.2 hrs on record,"Posted: September 28, 2024"
7.65612E+16,https://steamcommunity.com/profiles/76561197988395855/,"Valve do absolutely nothing to stop cheaters or toxic behaviour in this game. You can almost guarantee every match will have at least one person wall hacking or the even more obvious aim bots. There's instances where some servers will have multiple AI bots going at once so you can't even kick them. I only play with some friends I've made online to try and avoid it, but even that is rare.
The toxic behaviour I've come across as a female player is also incredibly bad, but again Valve do nothing about this either. I'm used to it having played these games for around 15 years, but it's a shame that still nothing is done about it these days.
Reporting anything gets you nowhere.
The game is also missing so many maps and modes that used to exist on previous versions of CS. If I didn't enjoy those random days with friends online I would just go ahead and uninstall it.",Not Recommended,714,"1,419.9 hrs on record","Posted: December 14, 2024"
realsnip4r,https://steamcommunity.com/id/realsnip4r/,"In one article Steam calls Jump Throws a key part of the game and the bind necessary. Later in that same article jump throws are now a bannable offense. WTF STEAM

BECAUSE OF THIS IF YOU EXECUTE A PERFECT JUMP THROW OR SOME OTHER MOVEMENTS OCCASIONALLY YOU WILL GET KICKED.",Not Recommended,225,"2,795.7 hrs on record","Posted: August 20, 2024"
heycunce,https://steamcommunity.com/id/heycunce/,"Game is rampant with cheaters, valve have done nothing to fix this - even releasing a new armoury feature to grab more cash.

Valve has become like the next betting agency, except the commodity is cases and skins. It still will drain your cash. Biggest fraud of the century!

Shame on you valve and GabeN. Shame on you.

Update: I sent my feedback directly to valve when the armoury was introduced. Today on the 14/11 they re-released de_train which I had suggested in the feedback. This was a warm welcome however I will still refuse to pay for more stuff ingame unless they fix the cheating issue. I would suggest that people that queue for 'premier' mode have a separate kernel-mode AC like FaceIT and other FPS like Valorant. They should also tick a box confirming they have a microphone and will use it, working as a team...",Not Recommended,685,764.5 hrs on record,"Posted: October 3, 2024"
7.65612E+16,https://steamcommunity.com/profiles/76561199233420992/,"cheaters,cheaters,cheaters.",Not Recommended,27,399.1 hrs on record,Posted: March 4
GRXXNSLXYXR,https://steamcommunity.com/id/GRXXNSLXYXR/,#AllowClassicOffensive,Not Recommended,22,463.2 hrs on record,Posted: May 8
7.65612E+16,https://steamcommunity.com/profiles/76561198875184188/,"ruined csgo when cs2 rolled out, game runs like ♥♥♥♥ unless you have a powerhouse pc. i beg we get csgo as a separate game",Not Recommended,98,147.1 hrs on record,Posted: January 4
gloomy_frog,https://steamcommunity.com/id/gloomy_frog/,"full of cheatrs,,, boring moment on this legendry game",Not Recommended,46,"4,393.1 hrs on record","Posted: August 18, 2024"
soppychico,https://steamcommunity.com/id/soppychico/,i used to think id never enjoy playing this game,Not Recommended,39,794.9 hrs on record,"Posted: October 3, 2024"
SallyDna,https://steamcommunity.com/id/SallyDna/,"Cheaters in comp, bots (made by other players) in casual game modes.",Not Recommended,57,"1,318.6 hrs on record",Posted: February 15
wias7_irl,https://steamcommunity.com/id/wias7_irl/,The worst successor to a game I have ever seen. The decision makers at Valve suck hard for ignoring the integrity and stability of a competitive game,Not Recommended,123,"4,321.7 hrs on record","Posted: October 21, 2024"
7.65612E+16,https://steamcommunity.com/profiles/76561198127000749/,"Too many cheaters, ♥♥♥♥ matchmaking, people are mostly toxic.

Game is awesome but not worth it, it's fun to play once in a while, but it definitely becomes frustrating because of the above.
It can still be fun, but I don't recommend it as main fps.",Not Recommended,206,326.3 hrs on record,"Posted: July 21, 2024"
7.65612E+16,https://steamcommunity.com/profiles/76561199210278246/,either u enter a game with little to no players or get a server full of farming bots and get instantly kicked out you play compi or premier you get hackers i mean it will better if you pinched your balls hard and try suffering this ♥♥♥♥♥♥♥ pain,Not Recommended,197,"1,056.3 hrs on record",Posted: February 18
ryumitsuowo,https://steamcommunity.com/id/ryumitsuowo/,cheater strike.,Not Recommended,14,357.0 hrs on record,Posted: April 4
cs2saman,https://steamcommunity.com/id/cs2saman/,"The counter game is full of cheaters, think about how to ban these players, the report section does not work at all, no matter what we report, the users will not be banned.",Not Recommended,140,"2,013.6 hrs on record","Posted: July 10, 2024"
7.65612E+16,https://steamcommunity.com/profiles/76561198980076036/,"This game is literally dead, 80% of all players are ♥♥♥♥♥♥♥ bots, VAC is useless, Valve doesn't give a ♥♥♥♥",Not Recommended,88,"1,289.3 hrs on record",Posted: May 8
7.65612E+16,https://steamcommunity.com/profiles/76561199395616274/,meh,Not Recommended,3,423.2 hrs on record,"Posted: July 2, 2024"
oldscooler,https://steamcommunity.com/id/oldscooler/,CS:GO was better.,Not Recommended,15,31.8 hrs on record,Posted: March 1
Fluminense,https://steamcommunity.com/id/Fluminense/,"Valve is today Actvision and if it keep going this way will be tomorrow ubisoft.


SAY NO TO OVERPRICED ARMORY PASS",Not Recommended,96,907.6 hrs on record,"Posted: October 3, 2024"
shayanops,https://steamcommunity.com/id/shayanops/,kiram too in game e kiri,Not Recommended,19,516.5 hrs on record,"Posted: October 19, 2024"
7.65612E+16,https://steamcommunity.com/profiles/76561198061761347/,"Game is destroyed. I dunno what did you do, but the netcode is sh1t and full unresponsive to play.

For some reason we keep playing this. Valve FIX network spikes. thanks

Update: I've noticed that Vienna Server is the worst so far. It is guaranteed that each time we are connecting to it, we will have random ping/ spikes.

I miss the old CS:GO days.",Not Recommended,290,446.7 hrs on record,"Posted: November 23, 2024"
7.65612E+16,https://steamcommunity.com/profiles/76561198557387326/,"Sadly this game is even ""BETTER"" than CS:GO, in fact it plays just like cheap copy of it. Yes they changed a few things in comparision to its predecessor but mostly for the worse. The core gameplay and gunplay still feel like a game from 2010 and is overated in my opinion. The community is toxic and there is still a rediculous amount of Hackers around. And i almost forgot, all the steam-achievments of CS:GO are gone! Great!
Long story short: NO, I WOULD DEFINETELY NOT RECOMMEND THIS GAME",Not Recommended,405,97.3 hrs on record,Posted: February 12
