SteamId,ProfileURL,ReviewText,Review,ReviewLength(Chars),PlayHours,DatePosted
officialra,https://steamcommunity.com/id/officialra/,You'll find less cheaters on Tinder,Not Recommended,30,254.2 hrs on record,"Posted: 21 May, 2024"
7.65612E+16,https://steamcommunity.com/profiles/76561198283377893/,It saddens me how a billion dollar revenue game doesn't have a proper anti-cheat.,Not Recommended,68,"10,244.1 hrs on record","Posted: 30 June, 2024"
7.65612E+16,https://steamcommunity.com/profiles/76561198444372929/,"A year has passed. Armory update is a cash grab with no real gameplay value. VAC nowhere to be found, no new maps, the CSGO community has been wiped off the face of the earth. Disgusting company",Not Recommended,158,"2,015.4 hrs on record","Posted: 3 October, 2024"
7.65612E+16,https://steamcommunity.com/profiles/76561198893790695/,"terrible anti cheat people are getting false bans for high sensitivity/amd drivers/console commands while real cheaters are not getting banned
- no new content for months
- no new operation (it's been 3+ years)
- tons of competitive/wingman/hostage maps missing from csgo
- deleted achievements from csgo with 1 pointless one just make new ones
- no danger zone
- no team deatmatch
- sub tick is garbage all we wanted was 128tick servers
- spaghetti net code
- no short mm
- no flying scoutsman
- replays are bugged
- no overwatch
- performance issues
- peekers advantage
- bad ranking system
- no economy changes despite MR12
- movement and shooting is worse compared to csgo

All of this while they make hundreds of millions of dollars from cases/keys and yet are unable to make any fun new content unbelievable, and yet they waste their time with boring hero shooter deadlock that they will abandon within the first few months after the release just like they did to TF2, LFD2, Dota Underlords, CS2 VALVE needs to wake up and start caring for their games",Not Recommended,890,47.7 hrs on record,"Posted: 19 August, 2024"
NivoiSR2nd,https://steamcommunity.com/id/NivoiSR2nd/,"Semi rage cheaters and wallhackers are not detected by Valve secure servers.
The current trust factor system is awful, it matches you up with and against cheaters.
If you have a cheater in your team and you want to kick him at the end of the match you'll get a cooldown.
if you grief the cheater you'll get a cooldown.
if you have cheaters against you and you're afk you're getting banned for 14 days.
if you report a cheater your trust factor decreases
The report button is useless unless it's for griefing reports.
Patch notes and ""major updates"" are awful, it's like valve putting the ""Anti cheat"" at the bottom of their priority.",Not Recommended,527,578.3 hrs on record,Posted: 8 March
7.65612E+16,https://steamcommunity.com/profiles/76561198969190268/,"EDIT: as of today 3.10.24 cs devs decided to release the most shamefull update and instead of operation (that a lot of people have been waiting for) they released a 16$ pass with no coin, no mission, no new maps, no new game modes what a joke, last operation Riptide cost 15$ and you could get 100 stars from it + coin and missions, now they wanna charge 16$ for only 40 stars ridiculous, ubisoft and ea should learn from valve how to rip the of their playerbase. Yet we are somehow STILL IN SEASON 1 OF PREMIER!!! Halooooo it's been a year.

Let’s be real: CS2 is an absolute disaster. If you think otherwise, you need to dive back into legacy CSGO to understand how a real game feels.
The fundamentals of CS2 are laughably worse; CSGO runs smoother, feels better, and offers movement that isn’t a clunky mess. You don’t have to take my word for it - most pro players have openly admitted that CSGO is superior in virtually every aspect except for graphics. The optimization in CSGO is the result of years of meticulous polishing, while CS2 feels like a half-baked joke that can’t afford to take its time. If it doesn’t improve at lightning speed, it’s destined to wither away and die.

People are rapidly losing faith in this entire project. It’s a sinking ship, and Valve seems completely oblivious to the chaos around them. Meanwhile, out-of-touch investors continue to throw money at Valve, clinging to the belief that the company will deliver the ""next big thing"" - whether it’s an operation, a major update, or something else entirely. This speculation might eventually bear fruit, but for now, it’s the only thing driving the recent spike in skin prices - not any real improvements in gameplay or the anti-cheat system. And don’t even get me started on the absurd slogan “what you see is what you get.” It’s a total farce, especially with the whole subtick system mess. The gameplay constantly feels like it’s off by a few milliseconds, making it frustrating and inconsistent. Valve seems more interested in chasing shiny new distractions like Deadlock, which will never match the success of either CSGO or CS2. Player numbers for that game are already dropping, and let’s be honest - the initial surge was just the excitement of a new Valve release. The gameplay is dull, the graphics are mediocre at best, and frankly, it’s just boring.

Valve completely dropped the ball with CS2. They should have delayed this train wreck by a couple of years. Imagine if they had launched this version as a beta today instead of pretending it’s a finished product; it wouldn’t be nearly as disappointing. And for the love of God, the anti-cheat system is an absolute nightmare. It’s so poorly implemented that it raises serious doubts about whether Valve even cares about fairness in the game. If they don’t wake up and address these glaring issues, they risk losing the dedicated player base that has stuck around through thick and thin. It’s infuriating to watch my beloved franchise decay and wither away due to Valve’s incompetence and laziness. They rake in billions upon billions and can’t afford to expand the development team working on CS2?",Not Recommended,2605,142.6 hrs on record,"Posted: 26 September, 2024"
80H8SU,https://steamcommunity.com/id/80H8SU/,"Unfortunately, it is truly a great game ruined by cheaters.

I had a very long break from CS (and gaming in general), so I was pretty excited to get back and enjoy the gameplay. That happened to be impossible as in at least 20% of your games you'll match up against someone cheating.
Back in 2014-2017 you would also occasionally meet someone cheating, but usually on higher ranks such as LE, LEM, SMFC, GE, that's why (I think) they cheated in the first place — to get to higher ranks and stay there.

Downloading CS years later (and having 0 skill left) I was surprised to find out that now you have silvers and novas flooded with cheaters, which makes 0 sense to me — What is those guys' goal? Why are they ranked so low using cheats? So, in 2025 cheating is not something you occasionally find among high-ranks competing between each other, but rather an issue you simply cannot avoid. Among other things, this makes the game very unfriendly for newbies who expect to play against someone in their skill bracket.

Someone might say ""you are just bad and that's why you think others cheat"" and while I get this POV, it is simply not the case. I might not be good anymore but I certainly remember the game's physics and stuff like that. It's quite easy to detect a cheater when you played the game for the first time in 2003. (Also, a 0 level, 1 year old, 50 hours in game Steam account having 80% HS% is simply something very, very suspicious).

Also someone might say ""just don't play on Valve's servers, go to FACEIT"". Firstly, I just want to casully play the game for an hour to relax, not to be all 'competitive' and ruin other's desire to win. Secondly, why can't the game be playable ""out of the box"" with no need to have any kind of 'add-ons'?

Well, I guess enough for a 'review'. This game will forever stay in my heart as it has brought an incalculable amount of fun into my life back in the days. And it also might bring it to someone today. But unfortunately not to me.",Not Recommended,1622,"3,472.8 hrs on record",Posted: 4 February
7.65612E+16,https://steamcommunity.com/profiles/76561198053757698/,"This game literally became UNPLAYABLE due to the USELESS VAC, so called ""anticheat"". At least 3 cheaters in each match on OFFICIAL VALVE servers... AND you can't even surrender because VALVE implemented this ""FEATURE"" when 5 teammates are present, you simply can't call a vote for surrender.... F*CK THIS PIECE OF GARBAGE.. AND I'm not talking as a silver player, I was a LEGIT global elite in CSGO back in the days... VALVE.. YOU ARE WASTING THE PLAYERS TIME........ FIX YOUR DAMN GAME!!!!!!!!!!!!",Not Recommended,416,"2,247.4 hrs on record","Posted: 10 May, 2024"
lepinpon,https://steamcommunity.com/id/lepinpon/,"Uninstalling.
I've been playing CS since 1.3. I played them all, 1.5 1.6, go, and now cs2.
Incredible game, but the competitive scene is full of hackers, not only blatant ones, but also sudden.
I have incredible reputation, old account, lots of reviews, and valve keeps matching me with 50 hours old accounts. Ridiculous. Matchmaking is BROKEN.
I'm not enjoying any match since my brain goes, ""he must be hacking"" every 1 minute.
BYE",Not Recommended,365,"2,112.5 hrs on record","Posted: 4 June, 2024"
Snicklefricks,https://steamcommunity.com/id/Snicklefricks/,"The amount of cheaters on this game is so bad it makes me not want to play it, feels like Valve doesn't care and the only thing they are focus on is making money from skins, counter strike matchmaking use to be the best ever, now it's unplayable",Not Recommended,198,"6,698.3 hrs on record","Posted: 19 November, 2024"
skillzexe,https://steamcommunity.com/id/skillzexe/,Overrun by cheaters. Performance gets worse with each update. Netcode is questionable at best. Still lacks content we had in CS:GO.,Not Recommended,111,757.8 hrs on record,"Posted: July 6, 2024"
milkyela,https://steamcommunity.com/id/milkyela/,Cheater-Strike 2,Not Recommended,15,557.7 hrs on record,"Posted: June 7, 2024"
7.65612E+16,https://steamcommunity.com/profiles/76561199838279861/,"Unplayable for newcomers. 9 out of 10 games are Hacker vs Hacker Lobbies.
thx valve for not giving a f*ck about your game and preferring to add skins instead of actually working on it",Not Recommended,151,60.9 hrs on record,Posted: April 18
BARM1918,https://steamcommunity.com/id/BARM1918/,"Still missing so much content from CS:GO and the new engine is horribly optimized.

Should have been left alone",Not Recommended,94,191.1 hrs on record,"Posted: December 5, 2024"
breakcoreee,https://steamcommunity.com/id/breakcoreee/,"ive been playing cs since i was 8, this game gave me a lot of great memories and friends, im grateful for all of that, but these memories are being absorded by shadow of excessive amount of cheaters and i wish that this problem will atleast be reduced to valorants level
#fixcs2",Not Recommended,228,"1,356.3 hrs on record",Posted: February 10
Loot,https://steamcommunity.com/id/Loot/,"Alright, I've been playing CS since 1.6. I know CS:GO had a rough first year after release, but CS2 really is something else. As someone that used to do tournaments and events with a team as a former semi-pro back in the day, this game has steered so far to terrible that it's just not worth wasting time on until it's in a proper playable state. It's a shell of what once was one of the most optimised FPS's out there and many other current pro players and former pro players will tell you the same thing. If you have a ping above 20, forget about it. The glitches, the cheaters, the lack of network utilisation, the lack of support for content creators, the deceit etc.. There's just so much wrong with this game right now. This review may change later, but I'm dead sick of trying to enjoy it as it once was. Perhaps it's my fault for moving over to Starlink, perhaps I'm getting old, or perhaps the years beforehand were my imagination, but no, it's not the case because others have the exact same issues and it seems Valve has turned a blind eye to them.",Not Recommended,861,"2,680.1 hrs on record","Posted: November 3, 2024"
n0namecs,https://steamcommunity.com/id/n0namecs/,"So many problems with this game... The developer gives 0 ♥♥♥♥♥ about this community. My main issue is just the gameplay being terrible in comparison to go, a clear downgrade and even noobs can tell right away if you were to compare side by side. Movement, shooting, peekers advantage, ping difference is just crazy in comparison. It's just such an unfinished product and It's really upsetting they did this to my favorite game ever. Valve lets cheaters run rampant for the entirety of launch and has done nothing, even making it harder to report players and taking away overwatch. They make a public ladder for them and incentivize them even more than before. Ruin one of my favorite maps train, waited so long for it to come out only for them to completely rework it and make it feel like a whole different map.

I have no hope for this game. They have all the money in the world but give no ♥♥♥♥♥, don't have the talent to fix any of the issues, don't have the understanding of the game to address them as issues, no transparency with the players, the direction of the game has been downhill for years and it only gets worse with time. It feels like we've been playing a beta for almost 2 years and it's just a joke. This game deserves to die and I hope it does.",Not Recommended,1032,"16,221.8 hrs on record",Posted: March 20
Nik4711,https://steamcommunity.com/id/Nik4711/,"After nearly 8,000 hours in cs:go, I think it's only fair to commit to saying that I am thoroughly disappointed with CS2. The game has taken the gripping core concept of a counter-strike game, and built around it with the primary goal of building esports and cosmetic frameworks to generate revenue. There have been numerous requests for changes that should have been prioritized, with no exaggeration, since 2015. Anti-cheat and tickrate have been eschewed to spend time developing cosmetics and designing gameplay within the skins economy rather than engaging with the gameplay of the core game. And with all this extra revenue, you really can't afford 128 tick, even just for premier or paying premier players?

The disrespect the continued non-development of the game itself reflects upon the community and the spirit that keeps the game alive should long ago have fractioned the playerbase, but the way back has been walled off by removing csgo from steam (possibly one of the most dishonest, anti-consumer moves i've ever seen). There is nothing honest going on at valve when it comes to cs2, and nothing elevating this game beyond a general shooter other than the allowance from valve for us measly customers to still interact with the core mechanics of counter-strike. perhaps they'll slowly sculpt this game into something decent, but the philosophy and principles pushing the counter-strike project at valve have long since left the realm of mechanics and passion for greener* pastures.",Not Recommended,1256,"8,577.9 hrs on record","Posted: October 8, 2024"
HazardBG,https://steamcommunity.com/id/HazardBG/,"It's disappointing to see how this game is evolving. The lack of concern for cheaters in the servers is appalling—there are no effective anti-cheat measures in place, nothing at all. I wouldn’t recommend wasting your time on this; it’s essentially a playground for cheaters to compete over who has the best hacks. Even some so-called 'pro-players' are resorting to cheating. Honestly, there’s not much more to say—just save yourself the frustration and avoid this mess.",Not Recommended,395,"1,849.7 hrs on record",Posted: February 20
evathlon,https://steamcommunity.com/id/evathlon/,"The lack of effective Anti-Cheat forces veteran players that wish to take this game seriously to play on 3rd party clients, which divides the community massively. However unfortunately as it stands there are also cheat bypasses for popular 3rd party clients too such as FACEIT. It feels as if Valve cares more about the economy of the skin market than they do about the actual gameplay which is understandable looking at the annual turnover of cases. I'm not going to recommend this game untill they add PROPER ANTI-CHEAT.",Not Recommended,435,73.0 hrs on record,Posted: January 11
Its_BLACKBURN,https://steamcommunity.com/id/Its_BLACKBURN/,"Full of cheaters, Anti-Cheat doesn't work, Not Optimized, full of bugs,The mechanics are faulty and many more.... .
Bring Back CS:GO. It doesn't worth it to play.",Not Recommended,137,908.5 hrs on record,"Posted: November 27, 2024"
306232,https://steamcommunity.com/id/306232/,"They murdered csgo. Replaced its dark, tactical style with a bright soulless esports style. Overwatch is gone. Server browser sucks. One pathetic achievement.",Not Recommended,136,432.0 hrs on record,Posted: April 16
7.65612E+16,https://steamcommunity.com/profiles/76561198070883380/,They are literally turning this game into a cash grab nothing else,Not Recommended,55,"2,962.8 hrs on record","Posted: October 3, 2024"
Butterhugger,https://steamcommunity.com/id/Butterhugger/,Imagine it being over a year since the release of a game and there are still 3 maps from the OFFICIAL trailer for CS2 that aren't in it yet. This most recent update is a testament to this development team's utter incompetence.,Not Recommended,185,"4,074.9 hrs on record","Posted: October 3, 2024"
7.65612E+16,https://steamcommunity.com/profiles/76561199171771762/,"1 Year since release. Hardly any anti cheat improvements, removed gamemodes, removed live games, removed OverWatch system, no seasons as promised, and now we get the barebones BattlePass with no missions, no co-op missions, no new maps, no new game modes, no medal and less rolls for $3-4 more then your average CSGO Operation Pass. Yikes.",Not Recommended,284,516.0 hrs on record,"Posted: October 3, 2024"
Pheyzon,https://steamcommunity.com/id/Pheyzon/,"Never start playing this game! It's like a toxic relationship: spend money, get mad and aggressive, quit, and then come right back to repeat the cycle once again because you cling to that one or two happy memories you've had with the game.

Just buy Animal Crossing or Minecraft or something. That sh*t is actually good for your mental health.",Not Recommended,285,633.2 hrs on record,"Posted: November 9, 2024"
steamydogshit,https://steamcommunity.com/id/steamydogshit/,"It's completely filled to the brim with cheaters.

Update 1/21/25:
- Unskilled players are now using DMA (Direct Memory Access) PCI Cards to cheat
- Combined with a second PC - a DMA card slotted in PC A sends realtime memory to PC B which can then be read/analyzed/acted upon
- PC B can simply read the memory on PC A, and can send realtime undetectable ESP onto PC A when combined with a display fuser
- DMA Card when also combined with a M&K Controller (""KMBox""), PC B can send realtime inputs (Aimbot, Triggerbot, etc) to PC A
- DMA Card can be repeatedly flashed with new firmware making detection near impossible
- There is an entire black market for undetectable firmware
- Valve doing nothing about these DMA Cards on top of not even issuing a statement shows they simply do not care about the ""elite competitive experience""
- Valve will take action against legitimate players finding a loophole in the Armory Pass, and in a few hours - but will not take any concrete action against players abusing the entire game (hacking) and for years

- VAC is the worst anti-cheat in existence. Valve takes HWID of users however, they will not ban based on HWID. They only ban by account so the hacker can just make a new one and do it all over again.
- Valve is making a huge profit off NOT banning hackers. When a hacker gets their account banned, they just get another one and purchase prime ($15). Valve clearly sees this as a revenue source and will never actually take any real action against cheaters.
- There is a secondary market for leveling fresh accounts to premiere and selling them, people use inexpensive hacks to level accounts and then re-sell them for more
- People are running automated AI-based bots that can dupe weapons and automatically cheat same as in TF2
- Premiere game mode is completely off balance. Once you reach 10k+ ELO your matches will only net you ~50-100 ELO and you will lose between ~300-1000 every game. Complete timesink.
- Valve's ""subtick"" is garbage. The game will always have peeker's advantage - if you have a high ping around around 50ms-100ms you will always have that much more time to see someone on your screen before they will see you
- Public ""find a group"" feature is filled with Russians posing as ""professional"" players who invite you to lobbies, try to get you into a discord channel and then socially engineer you to ""signup for their team"" which is a steam account phishing page.

Game is still fun and a classic - but is clearly still in an alpha development stage. Valve trying to claim or boast that CS2 is a ""competitive"" shooter is completely invalid. Any ""competitive"" teams are phony. Faceit, ESEA and competitive game modes all filled with blatant cheaters. You could dump years of time into this game trying to ""git gud"" but you will never beat the script kiddies let alone be able to keep up with the constant updates to the game mechanics.

I highly encourage everyone to play this game on competitive/premiere mode and treat it as if completely casual, because it is.",Not Recommended,2513,"2,207.5 hrs on record","Posted: July 18, 2024"
iimao,https://steamcommunity.com/id/iimao/,"Counter-Strike 2: A Masterclass in Downgrades

Ah, Counter-Strike 2. The long-awaited, heavily hyped, Source 2-powered evolution of the greatest tactical shooter of all time. And what did we get? A broken mess that makes you appreciate Counter-Strike: Global Offensive—a game we all spent years complaining about.

First, let's talk about the servers. You ever wanted to experience what it’s like to time travel? Well, now you can! Thanks to CS2’s incredible sub-tick system, every gunfight feels like you're guessing where the past version of your opponent might be, while the future version of yourself is already dead. Laggy peeks, input delay, and rubberbanding galore—it’s like Valve found the worst possible way to implement online gameplay and ran with it.

Then, we have the cheaters. Oh boy. If you ever dreamed of playing against professional aimlock enthusiasts in every second game, CS2 has you covered. The VAC system? Think of it as a museum piece—nice to look at but completely useless. Mass reporting doesn’t work, the cheaters never get banned, and somehow, they always win. It's almost impressive.

But don’t worry, CS2 did bring improvements! They gave us volumetric smokes—because that’s what everyone wanted, right? Not better matchmaking, not reliable hit registration, but dynamic, 3D smokes that look cool while you get shot through them by someone using wallhacks.

Meanwhile, Valorant exists, a game that actually runs well, has anti-cheat that does something, and doesn’t make you question if your bullets are real or just imaginary suggestions to the game engine.

Overall, Counter-Strike 2 is like getting a birthday gift from Valve where they take away your old toy and give you a newer, shinier, but completely broken version of it. 0/10 experience when playing, 10/10 experience when uninstalling.",Not Recommended,1548,"2,413.1 hrs on record",Posted: February 20
