SteamId,ProfileURL,ReviewText,Review,ReviewLength(Chars),PlayHours,DatePosted
7.65612E+16,https://steamcommunity.com/profiles/76561198987120623/,"i've been searching for a match for atleast 3 hours , fix your game !!",Not Recommended,56,"8,294.0 hrs on record","Posted: July 1, 2024"
7.65612E+16,https://steamcommunity.com/profiles/76561198236963970/,csgo was better,Not Recommended,13,237.9 hrs on record,Posted: May 8
7.65612E+16,https://steamcommunity.com/profiles/76561199613601419/,"Product received for free

Anti cheat? no",Not Recommended,36,14.3 hrs on record,"Posted: July 26, 2024"
7.65612E+16,https://steamcommunity.com/profiles/76561199117865688/,"Product received for free

lots of cheaters in game. also faceit servers are not available in India",Not Recommended,84,"1,207.0 hrs on record",Posted: January 9
asd5515515,https://steamcommunity.com/id/asd5515515/,This game kinda sucks,Not Recommended,18,"3,248.7 hrs on record","Posted: June 26, 2024"
oneslowDANCE,https://steamcommunity.com/id/oneslowDANCE/,You'll find less cheaters on Tinder.,Not Recommended,31,"2,319.6 hrs on record","Posted: June 7, 2024"
kvrkvrkvr,https://steamcommunity.com/id/kvrkvrkvr/,"cs2 has destroyed CSGO, a full game, in it's wake. it's a husk of a game. very few maps have been released. there aren't community servers in the official server browser. there are bugs introduced regularly. the VAC time out bug. the friendly fire in casual ban bug, at the time of writing, you can jump atop a player and get stuck midair together. there are better free FPSes out there. this is a legacy product. subpar. unoriginal.",Not Recommended,356,"2,495.4 hrs on record","Posted: August 9, 2024"
7.65612E+16,https://steamcommunity.com/profiles/76561199691306660/,"It has a massive cheating problem... its so easy to get cheats for this game its unreal, and the ""VAC"" anti cheat does absolutely ♥♥♥♥♥♥♥♥♥ to stop it! Let alone the bugs and the eternity you will spend waiting for a match only to get instantly headshotted through a wall leaving spawn...",Not Recommended,237,83.0 hrs on record,"Posted: October 3, 2024"
quissul,https://steamcommunity.com/id/quissul/,"vac is a complete joke and so is valve for being too incompetent to develop a proper anticheat in a quarter of a decade
play faceit",Not Recommended,107,"1,082.9 hrs on record",Posted: February 28
7.65612E+16,https://steamcommunity.com/profiles/76561198931645662/,GJ VAC useless anti-cheat ever,Not Recommended,26,"2,999.3 hrs on record",Posted: February 25
shtoobly,https://steamcommunity.com/id/shtoobly/,cs go was far better and I didn't even like cs go,Not Recommended,38,218.6 hrs on record,"Posted: June 28, 2024"
MarrMarruu,https://steamcommunity.com/id/MarrMarruu/,"Bad anti cheat system, cheater in every 2-3 games even in premier",Not Recommended,54,475.0 hrs on record,Posted: March 16
Isaah,https://steamcommunity.com/id/Isaah/,"cs 2 sucks ass, I would wait another year before playing it if you are new so the bugs can be worked out of it. If your coming from go you will think the game is complete ♥♥♥♥.",Not Recommended,139,"15,602.0 hrs on record","Posted: September 3, 2024"
ghostbuster11,https://steamcommunity.com/id/ghostbuster11/,30-60% upload packet loss since last update. Thx for nothing Valve,Not Recommended,56,"1,657.4 hrs on record","Posted: October 23, 2024"
7.65612E+16,https://steamcommunity.com/profiles/76561198939618552/,Since Cs2 release everything turned to ♥♥♥♥ except sound and texture,Not Recommended,58,"1,481.3 hrs on record","Posted: June 16, 2024"
ronpa,https://steamcommunity.com/id/ronpa/,Awful money grab of a patch. Patches come out slow unless the players find a way to have fun and come together as a community to make the add-on palatable. CS2 was a mistake so far.,Not Recommended,146,"2,005.1 hrs on record","Posted: October 5, 2024"
methplug,https://steamcommunity.com/id/methplug/,"HORRID GAME... PLAYER BASE IS TOO SWEATY, CANT EVEN HAVE FUN ANYMORE.",Not Recommended,58,"1,581.7 hrs on record","Posted: July 29, 2024"
7.65612E+16,https://steamcommunity.com/profiles/76561199833721739/,"The game is unplayable. Every time when you shoot a bullet is like you spin a roulette. Sometime is going in the upper left of the crosshair other time in the upper right or bottom left or bottom right and if you are lucky is going in the middle where is supposed to go. If you don't believe me, just enter a game and single shoot the weapon at the wall. I paid for the prime to stop playing with cheaters but I feel like if you don't play with a wallhack at least you don't have what to do on the official servers. I reached lvl 10 to play premier but even there are cheaters. I think I will search for a private server that are punishing the cheaters. Sadly they are not giving experience. I can't recommend this game when CS 1.6 is better in every possible way and he was released in 2000.",Not Recommended,637,54.3 hrs on record,Posted: April 12
7.65612E+16,https://steamcommunity.com/profiles/76561199104360494/,"Counter-Strike 2: Not an Update, a Rebirth
At first glance, you think — oh, it's just CS:GO with ray tracing and protein shakes. Then you play it. And you realize: nope, this isn’t an update. It’s like your good old AK-47 suddenly developed a sense of smell.

CS2 is still that same adrenaline-fueled classic where one bullet can change the round, but now everything feels tangible. Source 2 didn’t just slap on better graphics — it poured a bucket of raw concrete into the game. You can feel things now: water droplets from explosions, the flicker of your teammate’s shadow around the corner, and smoke that doesn’t just exist — it lives.

Speaking of smoke — it’s no longer a wall. It’s a character. It moves, it breathes, it reacts to grenades like it’s got emotions. I wouldn’t be surprised if it starts streaming on Twitch next year.

The guns? Still the same arsenal, but every reload feels like you’re reloading your soul. The AWP doesn’t just boom anymore — it tears a hole in reality, pauses time, and gently lets you back into the match.

Servers finally hit 128-tick, and that’s like upgrading from smoke signals to quantum teleportation. Every movement is a dance. Every kill? Poetry. The feel is tighter, snappier, and your muscle memory comes back like a loyal dog that never really left.

It’s not perfect — hitboxes sometimes act like confused teenagers, and the UI is a bit extra. Matchmaking still throws you in with people who think the bomb site is a Spotify playlist. But that’s fine. CS2 is a foundation, not a fad. It's here to evolve.

The Verdict:
CS2 isn’t the second chapter. It’s a second life. For the aim gods and the eco warriors. For the smurfs, the noobs, the spray control philosophers. It’s not just a game — it’s the art of control, the sound of chaos, and the silence before the last shot.

9.5/10 — Half a point off because there’s still no button that says, “Call mom, I clutched again.”",Recommended,1594,"1,678.2 hrs on record",Posted: 16 March
JustFaded,https://steamcommunity.com/id/JustFaded/,"More cheaters than on Tinder

Overall great game, just plagued with cheaters.",Recommended,67,845.0 hrs on record,Posted: 6 January
CheekyChick,https://steamcommunity.com/id/CheekyChick/,Met lots of gifted individuals that can look at the ground while spinning and still click heads. Very impressive!,Recommended,95,54.4 hrs on record,"Posted: 16 June, 2024"
7.65612E+16,https://steamcommunity.com/profiles/76561199124119258/,"Best way to experience racism even if your the same race and religion.


Recommended.",Recommended,73,249.6 hrs on record,"Posted: 22 May, 2024"
7.65612E+16,https://steamcommunity.com/profiles/76561198979212602/,"If i had a dollar for each time someone screamed at me in another language, i'd still have no money because i spent it on skins.",Recommended,103,163.8 hrs on record,"Posted: 3 July, 2024"
FATEYYYY,https://steamcommunity.com/id/FATEYYYY/,Casino Strike 2: Gamble Offensive,Recommended,29,"1,481.3 hrs on record","Posted: 23 July, 2024"
7.65612E+16,https://steamcommunity.com/profiles/76561198233986116/,"Lots of screaming, lots of racism, lots of sexism, lots of slurs, lots of angry russians. I can confirm it is the most peaceful game you will ever play. Peak of Games",Recommended,135,639.5 hrs on record,"Posted: 14 August, 2024"
PoorIsTheNewSwag,https://steamcommunity.com/id/PoorIsTheNewSwag/,"this game opened my eyes to new experiences such as: hand cramps, racism and mental instability",Recommended,80,4.7 hrs on record,Posted: 18 March
MrSyvex,https://steamcommunity.com/id/MrSyvex/,"Its a very good game and here is the advantages:
1-learning russian for free
2-rage quit
3-VAC can ban every one except the cheaters
4-Losing money because of opening the case
5-CS Knives are more expensive than real world knives
But honestly,Csgo was better
this game sucks
so valve fix them If you can",Recommended,258,576.2 hrs on record,Posted: 17 January
7.65612E+16,https://steamcommunity.com/profiles/76561199581654547/,"It doesn't matter if you have 100 hours of playtime, 1000 hours, or even 5000 hours, you will remain a noob forever. There are enough cheaters in the game to make you drop the game, but once you get caught up in this endless addiction, there is no turning back.",Recommended,212,"1,226.7 hrs on record",Posted: 5 April
counterstrikeceo,https://steamcommunity.com/id/counterstrikeceo/,no one is gonna see this but lord have mercy I love latinas,Recommended,47,"4,004.0 hrs on record","Posted: June 29, 2024"
7.65612E+16,https://steamcommunity.com/profiles/76561197985511866/,best game of the year,Recommended,17,"1,742.9 hrs on record","Posted: November 28, 2024"
bludwho,https://steamcommunity.com/id/bludwho/,"CounterStrike: Where the only thing more reliable than your terrible aim is the endless cheaters spinning around like they’re auditioning for Dancing with the Stars. You’ll learn real fast that the only thing more accurate than your gunshots are the cheaters aimbots, which somehow always seem to have perfect aim. But hey, at least you’ll get to experience the sweet, sweet thrill of a game where everything looks fine until you die in 0.1 seconds to someone who’s clearly not from this dimension. But don’t worry, Valve’s totally on it. I’m sure they’re working hard on that anti cheat system. Any day now. In the meantime, enjoy getting headshot by a guy who’s both floating and twerking through the map.
10/10 would totaly throw my keyboard across the room again.",Recommended,639,"1,122.8 hrs on record","Posted: November 10, 2024"
FL7CKED_HARDD,https://steamcommunity.com/id/FL7CKED_HARDD/,,Recommended,0,"29,408.7 hrs on record","Posted: October 29, 2024"
Jamomin,https://steamcommunity.com/id/Jamomin/,"This game will end friendships, break desks, and leave you feeling frustrated, tilted, swearing and sweating whilst you delete it only to reinstall an hour later.
Game 10/10
Valves input since release 2/10",Recommended,175,"5,626.4 hrs on record","Posted: October 13, 2024"
Nonni_the_Best,https://steamcommunity.com/id/Nonni_the_Best/,"> You see an enemy
> You shoot and miss almost every shot
> Enemy turns around
> One taps you
> ''Damage Given: 99 in 4 hits''

11/10 Best game EVER",Recommended,122,206.8 hrs on record,"Posted: September 18, 2024"
7.65612E+16,https://steamcommunity.com/profiles/76561198854614893/,"Every team consists of 5 people:
1.You
2.Russian Guy
3.Another Russian Guy
4.Russian Guy who speaks English
5. A 6 year old kid who slept with your mother

If i had a dollar for each time someone screamed at me in Russian language, i'd still have no money because i spent it all on skins.",Recommended,240,185.5 hrs on record,Posted: April 28
Arshiya_mgh,https://steamcommunity.com/id/Arshiya_mgh/,"cs2 is free , but I'm paying my sanity for it


cheaters telling me I'm the cheater
cheaters telling me they turned on their wall hack because they didn't like my mustache
cheaters act like we don't know they are cheating
cheaters one tap me and tell me its skill issue
cheaters pretend they don't use cheats so make the game 12-12 and I have to pay more sanity to play


i recommend this game 👍",Recommended,326,879.7 hrs on record,Posted: March 18
9-o-5,https://steamcommunity.com/id/9-o-5/,"Love being cheated on but hate going through the ""talking stage""? Well I got good news for you. In this game you can get cheated on for free or pay to be cheated on, and with our new graphics of cs2 you can do it in 4k 144hz saturation 200%. You can also buy new skins so you can look super dope and sick like a skater boy from tony hawk's pro skater 2 on the ps2.

anyways guys, enjoy the derank",Recommended,316,"1,020.9 hrs on record",Posted: January 8
7.65612E+16,https://steamcommunity.com/profiles/76561198292480887/,"The suffering I’ve endured from playing Counter-Strike is a complex blend of mental, emotional, and even physical pain. It begins with the countless hours spent grinding in competitive matches, where every loss feels like a personal failure, a reflection of my inadequacies. I’ve experienced the gut-wrenching agony of getting matched with teammates who seem to have no regard for teamwork or strategy, leaving me to carry the game on my own shoulders. The weight of that responsibility crushes my spirit, especially when I still lose despite my best efforts. Every missed shot feels like a betrayal of my own hands, a reminder that no matter how many hours I pour into improving my aim or game sense, there are still moments where I am utterly powerless. The suffocating tension of a 1v1 clutch situation is something I’ve felt in my bones, the pressure building as the seconds tick away, my palms sweating, heart racing, only to die to some sniper crouching in a corner, completely erasing any hope of victory.

The toxicity of the community adds another layer to the pain. It’s not just the personal failures; it’s the verbal abuse that follows. No matter how well I play, there’s always that one teammate who’s quick to hurl insults, to tear down whatever little confidence I’ve built. The constant barrage of blame, the accusations that I’m throwing the game or that I’m a noob, gnaws away at my self-esteem. Every match feels like a battlefield, not just against the enemy team but against my own squad, fighting to maintain my mental stability while being bombarded by insults, racial slurs, and unnecessary aggression. Then there’s the pain of seeing a perfectly executed strategy fall apart due to one small mistake, whether it's a missed flashbang or an ill-timed push. The frustration builds with every game, the crushing realization that even though I’ve spent hundreds, maybe thousands, of hours in the game, I’m still not where I want to be skill-wise.

Physically, the game has taken its toll as well. My back and wrists ache from sitting in the same position for hours, hunched over, eyes glued to the screen, fingers moving in a precise, rapid-fire rhythm. The late nights have robbed me of sleep, leaving me exhausted, but I can’t stop playing because I’m chasing that one good game, that fleeting moment of victory that keeps me coming back, even though deep down I know that satisfaction will never outweigh the frustration. Counter-Strike has become a cycle of suffering, where each win is quickly overshadowed by a string of losses, and every moment of joy is drowned out by the ever-present, gnawing feeling of defeat.

10/10",Recommended,2207,683.8 hrs on record,"Posted: September 21, 2024"
7.65612E+16,https://steamcommunity.com/profiles/76561197960381714/,"Counter Strike was once a great game, still good, but too bad its full of cheaters and scammers.

Anti cheat system is a joke. This game would be amazing, if it was free of cheaters and scammers.",Recommended,160,49.5 hrs on record,"Posted: October 8, 2024"
CivilightEterna-,https://steamcommunity.com/id/CivilightEterna-/,"A heaven game for smurfs, cheaters, griefers, etc., as they don't get punished for it

very nice",Recommended,81,211.1 hrs on record,"Posted: July 14, 2024"
1nsekt,https://steamcommunity.com/id/1nsekt/,"I’ve been playing CS for over 20 years. From 1.5 to 1.6, Source, GO... Cheaters were always around, but they were a fringe, shamed by the community, usually hiding in the shadows. After CS2 launched? It’s an absolute disaster. Cheaters don’t even try to hide anymore, running around with Scouts, landing headshots across the map like it’s a joke.

It perfectly reflects Gen Z's mindset, convinced they're the best at everything, yet can't handle losing without cheating to validate their delusions.

So here’s a reality check, boys:
Being proud of winning in CS2 while using cheats is like feeling satisfied that your wife had an orgasm, but only because another man gave it to her while you watched from the corner. Technically, you were there… but you weren’t really part of the achievement.

And VAC? If this whole thing were a metaphor, VAC would be Gaben in the corner, filming everything on a dusty VHS camcorder, silently watching while doing absolutely nothing.

Pros:
- I've spent tens of thousands of hours in this game over the years - and it gave me countless moments of pure joy, adrenaline, and unforgettable memories.
- The game sharpens your strategic thinking and decision-making speed like nothing else. It’s not just about aiming, it’s about reading the game, adapting, and outsmarting your opponent.

Cons:
- Kids today don’t understand that to be good at something, you need to put in real effort.
- Taking the easy way out (cheating) ruins the experience for everyone else.
- What CS2 has become: a playground for aimbotting, wallhacking clowns with zero shame is a disgrace to everything this game used to stand for.",Recommended,1375,"6,961.3 hrs on record",Posted: March 29
7.65612E+16,https://steamcommunity.com/profiles/76561199187949636/,"leads to gambling addiction, and including that you get free russian and romanian lessons when you ♥♥♥♥ something up

10/10",Recommended,105,47.6 hrs on record,Posted: April 22
7.65612E+16,https://steamcommunity.com/profiles/76561199554089715/,GOOD GAME NICE PHYSICS JUST VALVE NEED TO FIX THE ANTI CHEAT,Recommended,49,"1,663.9 hrs on record","Posted: June 10, 2024"
7.65612E+16,https://steamcommunity.com/profiles/76561199764468168/,"Genuine good game, but needs better anticheat. To many games get ruined because of this",Recommended,73,948.2 hrs on record,"Posted: October 6, 2024"
7.65612E+16,https://steamcommunity.com/profiles/76561198802596536/,"Best game with worst teammates.
I got so many Russians that now I can understand Russian better than rest of friends.
Very much recommended for keeping your life insane.",Recommended,143,422.2 hrs on record,Posted: March 19
ItsRB,https://steamcommunity.com/id/ItsRB/,"CSGO : expensive pixels, infested with cheaters and toxic players
CS2 : more variation of expensive pixels, infested with more cheaters and toxic players

but if you put your time and effort into it there's a chance you will learn either russian or chinese as a bonus

10/10",Recommended,230,"1,758.9 hrs on record","Posted: July 27, 2024"
7.65612E+16,https://steamcommunity.com/profiles/76561198126787344/,"Product received for free

Great game got into it not that long ago and pulled knife and gloves sold them for 1000$ ended up getting scammed by this guy https://steamcommunity.com/profiles/76561199418385433 10/10 experience",Recommended,193,49.5 hrs on record,Posted: January 17
lampieZA,https://steamcommunity.com/id/lampieZA/,"5 years of Counter-Strike, and it's been nothing short of a love-hate relationship. One minute, I’m popping off with a 3k, feeling like a pro. The next, I’m getting wallbanged through smoke and wondering why I ever started playing this game. But for some reason, I keep coming back. Maybe it’s the adrenaline, maybe the rage, or maybe I just thrive in the chaos. Would not recommend.",Recommended,317,"5,161.7 hrs on record","Posted: December 10, 2024"
h4rdjump_,https://steamcommunity.com/id/h4rdjump_/,she called me a cheater but I'm pretty sure she was talking about my CS2 skills,Recommended,64,36.0 hrs on record,Posted: April 18
7.65612E+16,https://steamcommunity.com/profiles/76561199767360247/,"fantastic game. Just needs to work on, cheating, movement, matchmaking, networking, community maps, cheating, anti-cheat, maps that have been gone for years. cheating. and add back signatures to trade ups",Recommended,175,80.5 hrs on record,"Posted: November 8, 2024"
esy_c,https://steamcommunity.com/id/esy_c/,Kinda like it,Recommended,11,"2,897.5 hrs on record","Posted: December 28, 2024"
7.65612E+16,https://steamcommunity.com/profiles/76561199156486047/,You can be as racist and as homophobic as you want without being banned. 10/10.,Recommended,65,255.3 hrs on record,"Posted: May 10, 2024"
7.65612E+16,https://steamcommunity.com/profiles/76561199367994883/,THE GAME IT SELF AMAZING BUT THE VAC BAN IS NOT WORKING PROPERLY,Recommended,52,"3,416.8 hrs on record","Posted: May 9, 2024"
Carpet_R1d3r,https://steamcommunity.com/id/Carpet_R1d3r/,"This game has two sides, ""Cyka Blyat Rush B"" or Cheaters in the closet sucking ♥♥♥♥ for fun. Recommend if you really hate yourself and looking for the final reason why.",Recommended,138,282.2 hrs on record,Posted: March 27
7.65612E+16,https://steamcommunity.com/profiles/76561198288450581/,"when you start a premier match , one of the 3 things will happen :

49.8%: you will be forced into a cage called ""team"" that consist of you and 4 retarded monkeys that speaks languge even Chatgpt never heard of

49.8%: the silver with software, in the second or third round after you peek him in the most default ah position ever, he will toggle his gay ass software and will start accusing you of cheating for the rest of the game

0.4%: normal ah team that is playable

TLDR: if you want to observe a zoo from your home this is the game for you",Recommended,444,"1,202.0 hrs on record",Posted: March 28
7.65612E+16,https://steamcommunity.com/profiles/76561198799335409/,"this is the worst game I've ever played. It makes me want to pull my hair out, punch my computer, set it on fire, sell all of my belongings, move to Ibiza, and live the rest of my life with the mere memories of its horrors.

anyways 10/10 would recommend :D",Recommended,208,522.7 hrs on record,"Posted: August 9, 2024"
reallyindigo,https://steamcommunity.com/id/reallyindigo/,,Recommended,0,"1,060.1 hrs on record","Posted: August 3, 2024"
kavt4,https://steamcommunity.com/id/kavt4/,"this game has caused me multiple brain injures and brain cancer from the amount of lack of iq from players of these games i have learnt 4 different languages and how to cuss in 15 different languages.
my iq before : 85
my iq now : 25

definitely recommend this game buy it as soon as u pull out 15$ out your 5$ monthly salary job.",Recommended,268,"1,334.5 hrs on record","Posted: August 8, 2024"
RealAbyss,https://steamcommunity.com/id/RealAbyss/,"-Install it
-Play it
-Got russians in my team
-Got 10 minutes long lesson of Russian
-lost 13-1
-got brain damage
-aproved the game to friends
-Good game",Recommended,133,37.2 hrs on record,Posted: April 28
7.65612E+16,https://steamcommunity.com/profiles/76561198939721272/,sexy game,Recommended,8,68.7 hrs on record,Posted: February 28
sexylesbians,https://steamcommunity.com/id/sexylesbians/,"game is almost as fun as lesbian scissoring

10/10",Recommended,43,"2,807.5 hrs on record","Posted: May 12, 2024"
JaxWaxFlax,https://steamcommunity.com/id/JaxWaxFlax/,"VAC still sucks c*ck and balls.
Sub-tick servers still suck c*ck and balls.
Case odds still suck c*ck and balls.
It's still better than Valorant, but that ain't saying much because that sh*t sucks major c*ck and balls.
HOWEVER, graphics look as nice as my c*ck and balls.(super nice, take my word for it)

Recommended only because CSGO was murdered for this shell of a replacement, Valorant is an e-couple cringe fest with overwatch abilities, and there's no other competition in this category.

That being said, when Cache returns, this game becomes 10/10.",Recommended,471,"2,245.5 hrs on record","Posted: December 16, 2024"
7.65612E+16,https://steamcommunity.com/profiles/76561198329973156/,"If valve installs a proper anti cheat and stops with battle passes the game would be much better. Game is 9/10, however until the fix the anti cheat and put back the gamemodes they took away im giving the game a 5/10",Recommended,175,"2,778.8 hrs on record","Posted: October 14, 2024"
tommgunner,https://steamcommunity.com/id/tommgunner/,Game is trash,Recommended,11,"1,042.3 hrs on record",Posted: May 1
charlesxxl,https://steamcommunity.com/id/charlesxxl/,Every playing 1 of 5 game is coming cheater. But i love this game i cant disconnect !!,Recommended,69,132.3 hrs on record,Posted: February 21
7.65612E+16,https://steamcommunity.com/profiles/76561199204078926/,"Product received for free

wow wonderful expireice with the fam the wife loves this game so much and the three little sons absolutely adore the voice chatting features. Recommended this game to a priest at church and haven't heard back since assuming he is loving it though, also if you turn on voice chat be sure to say hello and good luck to everyone overall the community is welcoming and slurs are absent! LOVE THE GAME! <3",Recommended,352,122.9 hrs on record,"Posted: September 4, 2024"
